batch,index,music,hashtag,author,likes,comments,shares,saves
1,0,original sound - YahneOfficialASMRBarbie,"facecard, asmrbarbie, asmr, asmrglue",yahneofficial,2700000,6190,137700,14400
1,1,original sound - onzpo,", onzpo, vfx, noeyefilter, ihaveeyes",onzpo,405900,18400,28300,1829
1,2,original sound - Cassidy Huff,"fyp, disability, foryou, disabled, mercedes, trend, tiktok, viral, accessibility, activism, prosthesis, hardofhearing, prosthetic, blind, lowvision, wheelchair, wheelchairuser, mobility, mobilityaid, deaf, hearingaid",casshuff,4500000,16000,296600,148500
1,3,Never Lose Me - Flo Milli,"badkidprom2023, seraphandroman",_seraphsworld_,653400,2944,64300,2357
1,4,The Hoes Gon Love This. All Rights Reserved - Cowboy Khai 🤠,,m6xence,637900,7679,37200,13200
1,5,I Wouldnt Mind - ♱,"fyp%E3%82%B7%E3%82%9Aviral, dancechallenge, fyp, tiktok, tiktokdancechallenge, viral, dancing, funtimes, tiktokuk, fypage, danceawesome, beyourself, dancing_time, viralvideos, trendingsong, @jerseyyjoe, trendingtiktok, trendingnow, dancingvideos, dancingchallenge, dancers, getthisviral, trendingsound, beyou",be_yourself_dylan,449500,7375,49700,34800
1,6,Je te laisserai de mots - noel.smt,,marti.p0122,7300000,37100,314400,47900
1,7,som original - Elerrander,"cirilaemariojoaquino, mariojoaquino, elerrander, cirila, reageelerrander, fy",elerrander_,308200,471,17300,826
1,8,original sound - Abbysaltzmaniscute,,abbysaltzmaniscute,21500,281,3626,59
2,0,original sound - Nick Shirley,,nickshirleyy,51900,6334,4131,4895
2,1,Oh No No No Laugh - Sound Effect,"elleking, grandoleopry, nashville, countrymusic, dollyparton, tributeshow, countrymusictiktoks, cancelled, dollyfam, dolly, drunk",jamiek721,88700,5043,5910,8913
2,2,XDDCC - Gooseworx & Evan Alderete,"bluey, blueytok, blueyheeler, blueyfanart, blueyclips, blueyanimation, animation, shorts, cute, procreate, cartoon, artistsoftiktok, art, shortclips, original, procreateanimation, procreatedreams, blueychilli, blueymom, blueymoments",artsdoodle,1800000,6308,269900,28600
2,3,Hurts Me (Alone At Prom) - Tory Lanez,", ghd, stylingtips, straightenercurls, flatironcurls, howtocurlhair, haircurltutorial, hairtok, curlingwithastraightener",ghdofficial,387300,815,130800,15000
2,4,Hard News - DM Production,"patrickmahomes, chiefs, taylorswift, swifties, riristea, rivetsoro",riristea,217200,304,5025,253
2,5,original sound - Posterised,"jayz, rap, hiphop, raptok, rapper, @lolnetwork",boardroom,471400,2080,19800,3420
2,6,original sound - Carlos_Eduardo_Espina,,carlos_eduardo_espina,110600,4210,7369,8874
2,7,original sound - big bruh,"lightningmcqueen, cars, lightningmcqueenedit, carsedit, fyp, viral",big.bruh4,1700000,11000,122100,1409
2,8,"Creepy piano, ghost story horror ambient：L(1025873) - cowaii - Fear music encyclopedia","greenscreenvideo, 2024, blizzard, chicagoblizzard, fyp, chicagoweather, chicago, freezing",metacowboy,157100,4611,14600,12700
2,9,From The Start Laufey - chris(ur fav Lauver),"@msmerli, foodporn, food, foodlovers, foodlover, foodieph, foodie, delicious, fyp, tiktokfood, foodtok, recipe, cooking, foodlover, delicious, yummy, abimarquez, desser, tanghulu, fruit, snack",abigailfmarquez,1700000,10100,368500,65400
2,10,"Painful, crying piano music with ambient sounds(1292263) - syummacha","truecrime, gypsyrose, gypsyroseblanchard, truecrimecommunity, truecrimeallthetime, crimetok, foryou",crimetimeteatimewithbree,124700,917,6037,871
2,11,original sound - nurse.johnn,"nursejohnn, nurselife, nursesoftiktok, nursehumor, nursetok, nurseproblems, nursing, nursingstudent, nursingschool, healthcareworker, healthcarehumor, hospitallife, hospitaltiktoks, medicalhumor, medicaltiktok, fyp, foryou",nurse.johnn,631600,2408,26600,14400
2,12,original sound - Alexandre Evidente,"corporatelife, gymrat, worklifebalance",trekfit,70100,2123,3609,1217
2,13,sonido original - Chava Pichardo,"toyotahilux, toyota22r, offroad, 4x4, todoterreno, viral",chavapichardoof,47500,502,3031,1234
2,14,som original - Royal News Channel,,royalnewschannel,68100,2103,5465,1414
2,15,It is a long song with a strong mystery.(1041687) - syummacha,"lanadelrey, musicindustrysecrets, darkhollywood, scary, creepy",grace.mitscherlich,522500,7747,73900,5423
2,16,original sound - Andrea,"f, fyp, foryourpage, tiktok, watch, fyp%E3%82%B7, music, singit, timmcgraw, timmcgrawconcert, toby, tobykeith, rememberingtobykeith, fyp, rip, livelikeyouweredying, emotional",andreaaaamooney,33100,578,2275,1872
2,17,Salsa Party 1 - Intermede Music,"vegas, lasvevas",immarcomurillo,744500,8821,40700,51700
2,18,MGK freestyle whos in my top ten machine gun kelly - mgkmagic,"machinegunkelly, mgk, colsonbaker",mgkmagic,30700,401,3338,1233
2,19,original sound - Space Jones,"yzypods, yeezy, vultures",spacejones,38700,1437,2629,3035
2,20,original sound - David Pakman,davidpakman,davidpakmanshow,24900,1579,802,286
2,21,original sound - Jessica Weslie Arena,"greenscreen, taylorswift, traviskelce, taylorswifttraviskelce, patrickmahomes, brittanymahomes, fyp",jessweslie,9901,680,404,613
2,22,original sound - Football Clips 🔥,"patrickmahomes, chiefs, superbowl",atfootballclips,447600,1737,21600,3145
2,23,original sound - Attorney Pish,"lawyer, law, facts, tips, learn",attorneypish,233200,14700,9834,3832
2,24,"Suspense, quiet urgency, suspicion, investigation：L(1029430) - cowaii - Fear music encyclopedia","superbowl, 49ers, baltimoreravens, conspiracytiktok, leaks",grace.mitscherlich,68400,1872,6242,3989
2,25,original sound - azyvixen,"twinsoftiktok, fraternaltwins, boygirltwins, momsoftiktok",azyvixen,1600000,7258,59200,7755
2,26,sonido original - Dr. Lliteras,"dormir, insomnio, ajustequiropractico, espalda, dolorcronico, contracturas, articulaciones, descansar, dormir, quiropractico, quiropraxia",drlliteras,82900,1403,10600,25000
2,27,original sound - OwnersBox,"nfl, superbowl, chiefs, 49ers",ownersbox,632900,13400,139800,12300
2,28,original sound - Lynja,,cookingwithlynja,123800,531,10500,982
2,29,Work (Originally Performed by Rihanna Ft. Drake) [Instrumental Version] - Hit The Button Karaoke,"sprinklesprinkle, shera, sheraseven, relationship, relationshipadvice, golddigger, richmen, rich, money",sprinklesprinkleclips,855000,4422,41600,19600
